{
  "format": "gridmason-build-spec/v1",
  "schema_version": 1,
  "artifact_id": "replace-with-project-id",
  "title": "Replace with build title",
  "target": {
    "edition": "java",
    "game_version": "REQUIRED",
    "environment": "vanilla",
    "loader_or_server": null
  },
  "coordinate_frame": {
    "x": "east-positive",
    "y": "up-positive",
    "z": "south-positive",
    "anchor": "minimum-corner"
  },
  "origin": {
    "x": 0,
    "y": 0,
    "z": 0
  },
  "size": {
    "x": 1,
    "y": 1,
    "z": 1
  },
  "air_policy": "omit",
  "palette": [
    {
      "key": "STONE",
      "block_id": "minecraft:stone",
      "states": {},
      "swatch": "#7C7C7C"
    }
  ],
  "placements": [
    {
      "x": 0,
      "y": 0,
      "z": 0,
      "palette": "STONE"
    }
  ],
  "unsupported": [
    "entities",
    "block_entities",
    "scheduled_ticks",
    "inventories",
    "biomes",
    "fluids",
    "commands",
    "native_formats",
    "world_actions"
  ],
  "provenance": {
    "basis": "player-approved formal placements",
    "evidence_status": "REPORTED",
    "notes": ""
  }
}
